baseId,featureName,featureDescription,emblemName,emblemDescription
1,终结,体力低于1/4时，消耗弱点记号的技能伤害增加25%，且使水泡必中并附加30点伤害,追击,命中率和闪避率提高10%
4,炎火,体力低于1/4时，火系技能造成的伤害增加25%，且使火焰必中并附加30点伤害,怒火,怒气回复率提高20%（攻击命中与回合结束回复的怒气除外）
7,坚韧,体力低于1/4时，受到的伤害减少25%，且使种子爆弹必中并附加30点伤害,治愈,体力回复率提高20%
10,入梦,首发时可以进入精灵的梦境,魅惑,免疫魅惑状态
146,腐蚀,自身具有焦点腐蚀时，技能威力增加10,吸取,攻击技能未命中时吸取对手10怒气
151,青蜂,攻击技能命中处于中毒状态的对手会重置中毒状态为3回合,蜂纹,对手具有蜂纹时，自身攻击技能造成伤害的1/10会恢复自身的体力
-1,骇浪,雨天环境下使用攻击技能恢复自身5怒气,龙牙,使用龙系技能同样适用本系加成
-4,魔焰,炎热环境下暴击率增加15%,火拳,对手怒气高于50时，自身技能威力增加25
-7,飞花,晴天环境下受到的暴击伤害减少25%,叶舞,使用物理技能附带35点固定伤害